{
  "contract": "io.clayz.presentation.retrieval-benchmark-report/1.0",
  "report_id": "benchmark-report-983808ac81e507c941bb",
  "benchmark_id": "benchmark.stage5-synthetic-feedback",
  "created_at": "2026-08-23T12:00:00Z",
  "provider_snapshots": [
    {
      "provider_id": "builtin-catalog",
      "digest": "d098eba31b8ba9493bef4f6ee6327005b9e6e1e3e5663e6a4e5bc63dea25e7eb",
      "record_count": 24
    },
    {
      "provider_id": "feedback-learning",
      "digest": "67ee4e7fbeb3428b68050e3e0356cfd5c44e145a458e66459bf1ffcfdc2881b4",
      "record_count": 1
    }
  ],
  "snapshot_drift": [],
  "cases": [
    {
      "case_id": "registered-composition-pattern",
      "expected_status": "matched",
      "actual_status": "matched",
      "top_k": 3,
      "expected_candidate_ids": [
        "pattern.asymmetric-evidence-to-decision"
      ],
      "actual_candidate_ids": [
        "pattern.asymmetric-evidence-to-decision"
      ],
      "missing_expected_ids": [],
      "forbidden_hits": [],
      "invented_ids": [],
      "receipt_id": "receipt-210fa554c5195061b9fe",
      "passed": true,
      "reasons": []
    },
    {
      "case_id": "registered-failure-pattern",
      "expected_status": "matched",
      "actual_status": "matched",
      "top_k": 3,
      "expected_candidate_ids": [
        "failure.semantic-visual-mismatch"
      ],
      "actual_candidate_ids": [
        "failure.semantic-visual-mismatch"
      ],
      "missing_expected_ids": [],
      "forbidden_hits": [],
      "invented_ids": [],
      "receipt_id": "receipt-6b75186ec5b870e98df3",
      "passed": true,
      "reasons": []
    },
    {
      "case_id": "human-admitted-learning",
      "expected_status": "matched",
      "actual_status": "matched",
      "top_k": 3,
      "expected_candidate_ids": [
        "learning.synthetic-label-offset"
      ],
      "actual_candidate_ids": [
        "learning.synthetic-label-offset"
      ],
      "missing_expected_ids": [],
      "forbidden_hits": [],
      "invented_ids": [],
      "receipt_id": "receipt-1e0b2c91d4e7891ab2fc",
      "passed": true,
      "reasons": []
    },
    {
      "case_id": "unregistered-request-stays-unresolved",
      "expected_status": "unresolved",
      "actual_status": "unresolved",
      "top_k": 3,
      "expected_candidate_ids": [],
      "actual_candidate_ids": [],
      "missing_expected_ids": [],
      "forbidden_hits": [],
      "invented_ids": [],
      "receipt_id": "receipt-d33d8bb83605e9aa2887",
      "passed": true,
      "reasons": []
    }
  ],
  "summary": {
    "case_count": 4,
    "passed_count": 4,
    "failed_count": 0,
    "snapshot_drift_count": 0,
    "passed": true
  },
  "guards": {
    "only_registered_records": true,
    "invented_record_count": 0,
    "automatic_baseline_update": false
  }
}
